{"schemaVersion":2,"contract":"wallet-detail","requestId":"request-synthetic","asOf":"2026-10-14T08:00:00+00:00","data":{"wallet":{"walletId":"wallet-synthetic","name":"Synthetic paper","kind":"paper","baseAssetId":"asset-usdt-synthetic","baseAssetCode":"USDT","createdAtUtc":"2026-10-14T08:00:00+00:00","archivedAtUtc":null},"openingFacts":[{"factId":"opening-synthetic","walletId":"wallet-synthetic","assetId":"asset-usdt-synthetic","quantity":"10000","openingAtUtc":"2026-10-14T08:00:00+00:00","source":"userDeclaredOpeningCapital","knownAtUtc":"2026-10-14T08:00:00+00:00","publicationSequence":1}],"openingBalanceBasis":{"receiptId":"basis-synthetic","walletId":"wallet-synthetic","assetId":"asset-usdt-synthetic","quantity":"10000","basisKind":"openingCapital","source":"userDeclaredOpeningCapital","sourceFactId":"opening-synthetic","sourceObservedAtUtc":null,"decisionAtUtc":"2026-10-14T08:00:00+00:00","knownAtUtc":"2026-10-14T08:00:00+00:00","quality":"declared","freshness":"notApplicable","publicationSequence":1}}}
